[
  {"id":"testnets-001","class":"class-7","subject":"testnets","topic":"purpose","difficulty":"beginner","question":"What is a blockchain testnet primarily used for?","options":["Testing applications without using valuable mainnet assets","Storing real-world cash","Guaranteeing production security","Replacing the mainnet permanently"],"correctAnswer":0,"explanation":"Testnets provide environments where developers can test transactions and applications using test assets rather than valuable production funds.","tags":["testnet","testing"],"reference":null},
  {"id":"testnets-002","class":"class-7","subject":"testnets","topic":"tokens","difficulty":"beginner","question":"What are testnet tokens generally intended to represent?","options":["Faucet-provided assets for testing","Guaranteed real-world money","Production ownership rights","Private keys"],"correctAnswer":0,"explanation":"Testnet tokens are typically distributed through faucets or other test mechanisms and are intended for development rather than real value.","tags":["faucet","test-tokens"],"reference":null},
  {"id":"testnets-003","class":"class-7","subject":"testnets","topic":"faucets","difficulty":"beginner","question":"What does a testnet faucet usually provide?","options":["Test tokens","Private keys","Mainnet profits","Exchange accounts"],"correctAnswer":0,"explanation":"A faucet distributes small amounts of test assets so developers can perform transactions on a test network.","tags":["faucet","tokens"],"reference":null},
  {"id":"testnets-004","class":"class-8","subject":"testnets","topic":"network-selection","difficulty":"beginner","question":"Why must a developer select the correct network in a wallet?","options":["Transactions and assets belong to specific networks","It changes the private key","It guarantees a successful transaction","It removes gas fees"],"correctAnswer":0,"explanation":"Wallets can interact with multiple networks, and selecting the wrong network can cause confusion or failed application interactions.","tags":["network","wallet"],"reference":null},
  {"id":"testnets-005","class":"class-8","subject":"testnets","topic":"rpc","difficulty":"beginner","question":"What does an RPC endpoint provide to a blockchain application?","options":["A way to communicate with a blockchain node or service","A replacement for a wallet seed","A token exchange guarantee","A physical server certificate"],"correctAnswer":0,"explanation":"RPC endpoints expose methods that applications and wallets can use to query network state and submit transactions.","tags":["rpc","nodes"],"reference":null},
  {"id":"testnets-006","class":"class-8","subject":"testnets","topic":"deployment","difficulty":"intermediate","question":"Why deploy a smart contract to a testnet before mainnet?","options":["To catch functional and integration problems at low financial risk","To make the contract automatically audited","To guarantee no bugs remain","To create real token value"],"correctAnswer":0,"explanation":"Testnet deployment allows developers to exercise contract logic, integrations and user flows before risking production assets.","tags":["deployment","smart-contracts"],"reference":null},
  {"id":"testnets-007","class":"class-8","subject":"testnets","topic":"chain-id","difficulty":"intermediate","question":"What is a chain ID used for?","options":["Identifying a blockchain network for transaction signing and replay protection","Generating seed phrases","Setting token prices","Selecting wallet colors"],"correctAnswer":0,"explanation":"Chain IDs distinguish networks and are part of mechanisms that prevent transactions from one network being replayed on another.","tags":["chain-id","transactions"],"reference":null},
  {"id":"testnets-008","class":"class-9","subject":"testnets","topic":"explorers","difficulty":"intermediate","question":"What can a testnet block explorer help a developer inspect?","options":["Transactions, blocks, addresses and contract activity","Private keys","Seed phrases","Offline hardware backups"],"correctAnswer":0,"explanation":"Block explorers provide public views of network data such as transactions, blocks, addresses and contract interactions.","tags":["explorer","debugging"],"reference":null},
  {"id":"testnets-009","class":"class-9","subject":"testnets","topic":"debugging","difficulty":"intermediate","question":"What is a useful first step when a testnet transaction fails?","options":["Inspect the error, network, gas and transaction parameters","Send the same transaction repeatedly","Expose the private key","Switch randomly between networks"],"correctAnswer":0,"explanation":"Checking the error and transaction parameters helps isolate issues such as insufficient test funds, wrong network or contract reverts.","tags":["debugging","transactions"],"reference":null},
  {"id":"testnets-010","class":"class-9","subject":"testnets","topic":"environment-separation","difficulty":"intermediate","question":"Why should test and production credentials be separated?","options":["To reduce the chance that development code can access production assets","To make testnets faster","To remove all security controls","To reuse one private key everywhere"],"correctAnswer":0,"explanation":"Separating environments limits the blast radius of leaked credentials, configuration mistakes and unsafe test code.","tags":["security","environments"],"reference":null},
  {"id":"testnets-011","class":"class-10","subject":"testnets","topic":"ci","difficulty":"intermediate","question":"How can testnets support continuous integration?","options":["Automated workflows can deploy and exercise applications against a predictable test environment","They eliminate unit tests","They replace source control","They guarantee no production incidents"],"correctAnswer":0,"explanation":"Testnets can provide an integration environment where deployment and transaction flows are exercised automatically before production release.","tags":["ci","automation"],"reference":null},
  {"id":"testnets-012","class":"class-10","subject":"testnets","topic":"faucet-security","difficulty":"intermediate","question":"Why should developers verify a faucet website before connecting a wallet?","options":["Fake faucets can be used for phishing or malicious approvals","All faucets require private keys","Verification changes the token supply","Testnet websites cannot be malicious"],"correctAnswer":0,"explanation":"Attackers may impersonate faucet services to trick users into revealing secrets or signing malicious transactions.","tags":["faucet","phishing"],"reference":null},
  {"id":"testnets-013","class":"class-10","subject":"testnets","topic":"reproducibility","difficulty":"advanced","question":"Why is reproducible test configuration useful?","options":["It makes failures easier to reproduce and diagnose","It guarantees mainnet success","It prevents all contract upgrades","It hides transactions"],"correctAnswer":0,"explanation":"Consistent network, contract and dependency configuration makes test results more reliable and debugging more systematic.","tags":["reproducibility","testing"],"reference":null},
  {"id":"testnets-014","class":"class-11","subject":"testnets","topic":"contract-verification","difficulty":"advanced","question":"Why verify a deployed contract on a block explorer when supported?","options":["It lets others inspect the published source associated with the deployed bytecode","It changes the contract address","It grants ownership automatically","It hides implementation details"],"correctAnswer":0,"explanation":"Source verification can improve transparency by showing how published source corresponds to deployed contract bytecode.","tags":["verification","transparency"],"reference":null},
  {"id":"testnets-015","class":"class-11","subject":"testnets","topic":"state","difficulty":"advanced","question":"Why can testnet state differ from mainnet state?","options":["They are separate networks with different histories, accounts and deployed contracts","They share every block","Testnet state is always copied from mainnet","Wallets determine blockchain state"],"correctAnswer":0,"explanation":"A testnet has its own chain history and state, so contracts, balances and activity cannot be assumed to match mainnet.","tags":["state","networks"],"reference":null},
  {"id":"testnets-016","class":"class-11","subject":"testnets","topic":"release-process","difficulty":"advanced","question":"What should a production release checklist include after testnet validation?","options":["Correct network, audited configuration, production credentials and rollback considerations","A testnet private key","Random RPC endpoints","Unreviewed contract changes"],"correctAnswer":0,"explanation":"A release checklist should ensure production-specific configuration and credentials are correct and that operational recovery has been considered.","tags":["release","operations"],"reference":null},
  {"id":"testnets-017","class":"class-12","subject":"testnets","topic":"consensus","difficulty":"advanced","question":"Why can consensus behavior matter when testing an application?","options":["Finality and transaction ordering affect application assumptions","Consensus only changes website colors","Applications never depend on confirmations","Consensus controls private keys"],"correctAnswer":0,"explanation":"Applications may depend on confirmation depth, finality and ordering, so test environments should be used to validate those assumptions.","tags":["consensus","finality"],"reference":null},